{
  "$schema": "https://json-schema.org/draft/2020-12/schema",
  "$id": "urn:eh:schema:v1:calibration-manual-qa-review-policy",
  "title": "EffortHours manual-QA development review policy v1",
  "type": "object",
  "required": [
    "schemaVersion",
    "policyVersion",
    "id",
    "authoringVersion",
    "licenseExpression",
    "maturity",
    "rubric",
    "sourceCorpus",
    "partition",
    "profile",
    "baselineId",
    "candidateVisibility",
    "eligibleCategories",
    "expectedRecordCount",
    "expectedTargetCount",
    "hiddenInputs",
    "requiredReviewPractices",
    "limitations"
  ],
  "properties": {
    "schemaVersion": { "const": "1.0.0" },
    "policyVersion": { "type": "string", "minLength": 1 },
    "id": { "type": "string", "minLength": 1 },
    "authoringVersion": { "type": "string", "minLength": 1 },
    "licenseExpression": { "const": "MIT" },
    "maturity": { "type": "string", "minLength": 1 },
    "rubric": { "$ref": "#/$defs/rubric" },
    "sourceCorpus": { "$ref": "#/$defs/corpusReference" },
    "partition": { "const": "development" },
    "profile": { "const": "implementation" },
    "baselineId": { "type": "string", "minLength": 1 },
    "candidateVisibility": { "const": "blind" },
    "eligibleCategories": {
      "type": "array",
      "minItems": 1,
      "uniqueItems": true,
      "items": { "$ref": "#/$defs/category" }
    },
    "expectedRecordCount": { "type": "integer", "minimum": 1 },
    "expectedTargetCount": { "type": "integer", "minimum": 1 },
    "hiddenInputs": {
      "type": "array",
      "minItems": 1,
      "uniqueItems": true,
      "items": { "type": "string", "minLength": 1 }
    },
    "requiredReviewPractices": {
      "type": "array",
      "minItems": 1,
      "uniqueItems": true,
      "items": { "type": "string", "minLength": 1 }
    },
    "limitations": {
      "type": "array",
      "minItems": 1,
      "uniqueItems": true,
      "items": { "type": "string", "minLength": 1 }
    }
  },
  "additionalProperties": false,
  "$defs": {
    "rubric": {
      "type": "object",
      "required": ["id", "version"],
      "properties": {
        "id": { "type": "string", "minLength": 1 },
        "version": { "type": "string", "minLength": 1 }
      },
      "additionalProperties": false
    },
    "corpusReference": {
      "type": "object",
      "required": ["id", "version", "digest"],
      "properties": {
        "id": { "type": "string", "minLength": 1 },
        "version": { "type": "string", "minLength": 1 },
        "digest": { "type": "string", "pattern": "^sha256:[0-9a-f]{64}$" }
      },
      "additionalProperties": false
    },
    "category": {
      "enum": [
        "production-implementation",
        "ui-implementation-and-represented-ux-decisions",
        "data-modeling-persistence-and-migrations",
        "external-integrations-and-protocols",
        "unit-testing",
        "integration-contract-and-component-testing",
        "end-to-end-and-ui-testing",
        "build-configuration-and-developer-tooling",
        "ci-cd-and-infrastructure-as-code",
        "security-and-accessibility",
        "packaging-deployment-and-release-artifacts"
      ]
    }
  }
}
